{
  "schema_version": "readiness-result/1.0.0",
  "manifest": {
    "mode": "independent",
    "auth_tier": "cert-app-only",
    "tenant": {
      "slug": "eval-fresh-gap",
      "kind": "sim"
    },
    "operator": {
      "name": "ces-tester",
      "role": "orchestrator"
    },
    "engagement_id": "mu-discovery-eval-fresh-gap",
    "party_id": "mu-discovery-eval-fresh-gap",
    "engagement_kind": "prime_and_subs",
    "started_at": "2026-08-31T04:43:47.117Z",
    "completed_at": "2026-08-31T04:45:00.717Z"
  },
  "observations": [
    {
      "control_id": "AC.L1-3.1.1",
      "objective_ids": [],
      "confidence": "low",
      "ran_entry_ids": [
        "AC.L2-3.1.1.operator-discover"
      ],
      "derived_posture": "unknown"
    },
    {
      "control_id": "AC.L1-3.1.2",
      "objective_ids": [],
      "confidence": "low",
      "ran_entry_ids": [
        "AC.L2-3.1.1.operator-discover"
      ],
      "derived_posture": "unknown"
    },
    {
      "control_id": "AC.L2-3.1.7",
      "objective_ids": [],
      "confidence": "low",
      "ran_entry_ids": [
        "AC.L2-3.1.1.operator-discover"
      ],
      "derived_posture": "unknown"
    },
    {
      "control_id": "AC.L1-3.1.1",
      "objective_ids": [],
      "confidence": "low",
      "ran_entry_ids": [
        "AC.L2-3.1.1.group-create"
      ],
      "derived_posture": "unknown"
    },
    {
      "control_id": "AC.L1-3.1.1",
      "objective_ids": [],
      "confidence": "low",
      "ran_entry_ids": [
        "AC.L2-3.1.1.member-add"
      ],
      "derived_posture": "unknown"
    },
    {
      "control_id": "AC.L2-3.1.2",
      "objective_ids": [],
      "confidence": "low",
      "ran_entry_ids": [
        "AC.L2-3.1.2.role-assign"
      ],
      "derived_posture": "unknown"
    },
    {
      "control_id": "AC.L2-3.1.3",
      "objective_ids": [],
      "confidence": "low",
      "ran_entry_ids": [
        "AC.L2-3.1.3.sensitivity-label"
      ],
      "derived_posture": "unknown"
    },
    {
      "control_id": "AC.L2-3.1.3",
      "objective_ids": [],
      "confidence": "high",
      "ran_entry_ids": [
        "AC.L2-3.1.3.dlp-policy"
      ],
      "raw_capture_ref": "captures/AC.L2-3.1.3.dlp-policy.txt",
      "derived_posture": "met"
    },
    {
      "control_id": "AC.L2-3.1.3",
      "objective_ids": [],
      "confidence": "low",
      "ran_entry_ids": [
        "AC.L2-3.1.3.service-account"
      ],
      "derived_posture": "unknown"
    },
    {
      "control_id": "AC.L2-3.1.4",
      "objective_ids": [],
      "confidence": "high",
      "ran_entry_ids": [
        "AC.L2-3.1.4.pim-policy-get"
      ],
      "raw_capture_ref": "captures/AC.L2-3.1.4.pim-policy-get.txt",
      "derived_posture": "met"
    },
    {
      "control_id": "AC.L2-3.1.4",
      "objective_ids": [],
      "confidence": "low",
      "ran_entry_ids": [
        "AC.L2-3.1.4.pim-approval"
      ],
      "derived_posture": "unknown"
    },
    {
      "control_id": "AC.L2-3.1.5",
      "objective_ids": [],
      "confidence": "low",
      "ran_entry_ids": [
        "AC.L2-3.1.5.pim-eligible"
      ],
      "derived_posture": "unknown"
    },
    {
      "control_id": "AC.L2-3.1.7",
      "objective_ids": [],
      "confidence": "low",
      "ran_entry_ids": [
        "AC.L2-3.1.5.pim-eligible"
      ],
      "derived_posture": "unknown"
    },
    {
      "control_id": "SC.L2-3.13.3",
      "objective_ids": [],
      "confidence": "low",
      "ran_entry_ids": [
        "AC.L2-3.1.5.pim-eligible"
      ],
      "derived_posture": "unknown"
    },
    {
      "control_id": "AC.L2-3.1.7",
      "objective_ids": [],
      "confidence": "low",
      "ran_entry_ids": [
        "AC.L2-3.1.7.pim-roles-eligible"
      ],
      "derived_posture": "unknown"
    },
    {
      "control_id": "AC.L2-3.1.7",
      "objective_ids": [],
      "confidence": "low",
      "ran_entry_ids": [
        "AC.L2-3.1.7.pim-roles-permanent"
      ],
      "derived_posture": "unknown"
    },
    {
      "control_id": "AC.L2-3.1.6",
      "objective_ids": [],
      "confidence": "high",
      "ran_entry_ids": [
        "AC.L2-3.1.6.admin-account"
      ],
      "raw_capture_ref": "captures/AC.L2-3.1.6.admin-account.txt",
      "derived_posture": "met"
    },
    {
      "control_id": "AC.L2-3.1.8",
      "objective_ids": [],
      "confidence": "high",
      "ran_entry_ids": [
        "AC.L2-3.1.8.smart-lockout"
      ],
      "raw_capture_ref": "captures/AC.L2-3.1.8.smart-lockout.txt",
      "derived_posture": "met"
    },
    {
      "control_id": "AC.L2-3.1.9",
      "objective_ids": [],
      "confidence": "high",
      "ran_entry_ids": [
        "AC.L2-3.1.9.terms-of-use"
      ],
      "raw_capture_ref": "captures/AC.L2-3.1.9.terms-of-use.txt",
      "derived_posture": "met"
    },
    {
      "control_id": "AC.L2-3.1.10",
      "objective_ids": [],
      "confidence": "low",
      "ran_entry_ids": [
        "AC.L2-3.1.10.screen-lock"
      ],
      "derived_posture": "unknown"
    },
    {
      "control_id": "SC.L2-3.13.9",
      "objective_ids": [],
      "confidence": "low",
      "ran_entry_ids": [
        "AC.L2-3.1.10.screen-lock"
      ],
      "derived_posture": "unknown"
    },
    {
      "control_id": "AC.L2-3.1.11",
      "objective_ids": [],
      "confidence": "low",
      "ran_entry_ids": [
        "AC.L2-3.1.11.session-timeout"
      ],
      "derived_posture": "unknown"
    },
    {
      "control_id": "AC.L2-3.1.12",
      "objective_ids": [],
      "confidence": "low",
      "ran_entry_ids": [
        "AC.L2-3.1.12.named-location"
      ],
      "derived_posture": "unknown"
    },
    {
      "control_id": "AC.L2-3.1.14",
      "objective_ids": [],
      "confidence": "high",
      "ran_entry_ids": [
        "AC.L2-3.1.14.block-untrusted"
      ],
      "raw_capture_ref": "captures/AC.L2-3.1.14.block-untrusted.txt",
      "derived_posture": "met"
    },
    {
      "control_id": "SC.L2-3.13.7",
      "objective_ids": [],
      "confidence": "high",
      "ran_entry_ids": [
        "AC.L2-3.1.14.block-untrusted"
      ],
      "raw_capture_ref": "captures/AC.L2-3.1.14.block-untrusted.txt",
      "derived_posture": "met"
    },
    {
      "control_id": "AC.L2-3.1.15",
      "objective_ids": [],
      "confidence": "high",
      "ran_entry_ids": [
        "AC.L2-3.1.15.admin-mfa"
      ],
      "raw_capture_ref": "captures/AC.L2-3.1.15.admin-mfa.txt",
      "derived_posture": "met"
    },
    {
      "control_id": "AC.L2-3.1.16",
      "objective_ids": [],
      "confidence": "low",
      "ran_entry_ids": [
        "AC.L2-3.1.16.wifi-profile"
      ],
      "derived_posture": "unknown"
    },
    {
      "control_id": "AC.L2-3.1.18",
      "objective_ids": [],
      "confidence": "low",
      "ran_entry_ids": [
        "AC.L2-3.1.18.mobile-ca"
      ],
      "derived_posture": "unknown"
    },
    {
      "control_id": "AC.L2-3.1.18",
      "objective_ids": [],
      "confidence": "low",
      "ran_entry_ids": [
        "AC.L2-3.1.18.byod-nonbrowser-block"
      ],
      "derived_posture": "unknown"
    },
    {
      "control_id": "AC.L2-3.1.19",
      "objective_ids": [],
      "confidence": "low",
      "ran_entry_ids": [
        "AC.L2-3.1.18.byod-nonbrowser-block"
      ],
      "derived_posture": "unknown"
    },
    {
      "control_id": "CM.L2-3.4.6",
      "objective_ids": [],
      "confidence": "low",
      "ran_entry_ids": [
        "AC.L2-3.1.18.byod-nonbrowser-block"
      ],
      "derived_posture": "unknown"
    },
    {
      "control_id": "AC.L2-3.1.18",
      "objective_ids": [],
      "confidence": "high",
      "ran_entry_ids": [
        "AC.L2-3.1.18.byod-nonbrowser-signins"
      ],
      "raw_capture_ref": "captures/AC.L2-3.1.18.byod-nonbrowser-signins.txt",
      "derived_posture": "met"
    },
    {
      "control_id": "AC.L2-3.1.19",
      "objective_ids": [],
      "confidence": "high",
      "ran_entry_ids": [
        "AC.L2-3.1.18.byod-nonbrowser-signins"
      ],
      "raw_capture_ref": "captures/AC.L2-3.1.18.byod-nonbrowser-signins.txt",
      "derived_posture": "met"
    },
    {
      "control_id": "AC.L1-3.1.22",
      "objective_ids": [],
      "confidence": "high",
      "ran_entry_ids": [
        "AC.L2-3.1.3.byod-dlp-policies"
      ],
      "raw_capture_ref": "captures/AC.L2-3.1.3.byod-dlp-policies.txt",
      "derived_posture": "met"
    },
    {
      "control_id": "MP.L2-3.8.8",
      "objective_ids": [],
      "confidence": "high",
      "ran_entry_ids": [
        "AC.L2-3.1.3.byod-dlp-policies"
      ],
      "raw_capture_ref": "captures/AC.L2-3.1.3.byod-dlp-policies.txt",
      "derived_posture": "met"
    },
    {
      "control_id": "MP.L2-3.8.9",
      "objective_ids": [],
      "confidence": "high",
      "ran_entry_ids": [
        "AC.L2-3.1.3.byod-dlp-policies"
      ],
      "raw_capture_ref": "captures/AC.L2-3.1.3.byod-dlp-policies.txt",
      "derived_posture": "met"
    },
    {
      "control_id": "AC.L1-3.1.22",
      "objective_ids": [],
      "confidence": "low",
      "ran_entry_ids": [
        "AC.L2-3.1.3.byod-dlp-matches"
      ],
      "derived_posture": "unknown"
    },
    {
      "control_id": "MP.L2-3.8.8",
      "objective_ids": [],
      "confidence": "low",
      "ran_entry_ids": [
        "AC.L2-3.1.3.byod-dlp-matches"
      ],
      "derived_posture": "unknown"
    },
    {
      "control_id": "SC.L2-3.13.16",
      "objective_ids": [],
      "confidence": "low",
      "ran_entry_ids": [
        "SC.L2-3.13.16.byod-sensitivity-labels"
      ],
      "derived_posture": "unknown"
    },
    {
      "control_id": "AC.L2-3.1.19",
      "objective_ids": [],
      "confidence": "low",
      "ran_entry_ids": [
        "SC.L2-3.13.16.byod-sensitivity-labels"
      ],
      "derived_posture": "unknown"
    },
    {
      "control_id": "SC.L2-3.13.8",
      "objective_ids": [],
      "confidence": "low",
      "ran_entry_ids": [
        "SC.L2-3.13.16.byod-sensitivity-labels"
      ],